### ISSUE TITLE
Inbound ESP packets dropped ?

### ISSUE THREAD

**Issue by bramton** [openiked/openiked-portable#93]
This issue has me stumped for several weeks now, I have been trying to use OpenIKED on FreeBSD 13.1 as an alternative to strongSwan, but inbound ESP packets keep being dropped when I try to use OpenIKED. This is not the case for strongSwan. The only relevant difference between the two which I can see is the `require` vs the `unique:1`.

Dumping the statistics on the ESP protocol shows a hint:
```
duvel# netstat -ss -p esp
esp:
        5396 packets dropped; no TDB
        2828 packets in
        8029 packets out
        245380 bytes in
        667044 bytes out
        ESP output histogram:
                aes-gcm-16: 10857
```
It shows that packets are dropped due to a Tunnel Descriptor Block (TDB)  not found(?). My best guess is that there is a policy miss-match on the inbound packets. Outbound seem to be fine.

I would really appreciate it if someone could shine some light on the matter. I have summarised all the relevant information below.
Note: this is a cross-post from a question on the[ FreeBSD-forums](https://forums.freebsd.org/threads/ipsec-incoming-esp-packets-dropped.86931/).

# OpenIKED

## Config
```
ikev2 "bram" esp \
        from 192.168.0.42 to 10.0.5.0/24 \
        local 192.168.0.42 peer any \
        srcid vpn.cbbg.nl \
        config address 10.0.5.100/32 \
        config name-server 192.168.0.42
```

## Network dumps
```
Interface: em0
11:46:50.403698 IP 192.168.0.42.4500 > 77.63.3.10.20489: UDP-encap: ESP(spi=0xc660b412,seq=0x44), length 120
11:46:50.710607 IP 77.63.3.10.20489 > 192.168.0.42.4500: UDP-encap: ESP(spi=0xa4c0e44c,seq=0x4c), length 120

Interface: enc0
11:46:50.403657 (authentic,confidential): SPI 0xc660b412: IP 192.168.0.42 > 10.0.5.100: ICMP echo request, id 59458, seq 85, length 64
Notice: no reply to the echo request
```

### Policy
```
duvel# setkey -PD
10.0.5.0/24[any] 192.168.0.42[any] any
        in ipsec
        esp/tunnel/77.63.3.10-192.168.0.42/require
        spid=218 seq=1 pid=82685 scope=global
        refcnt=1
192.168.0.42[any] 10.0.5.0/24[any] any
        out ipsec
        esp/tunnel/192.168.0.42-77.63.3.10/require
        spid=217 seq=0 pid=82685 scope=global
        refcnt=2
```
### SA
```		
duvel# setkey -D
192.168.0.42[4500] 77.63.3.10[20489]
        esp-udp mode=tunnel spi=3328226322(0xc660b412) reqid=0(0x00000000)
        E: aes-gcm-16  8c7406d0 ab6e11f7 46f673bc 02ba2534 bef324cc
        seq=0x00000134 replay=64 flags=0x00000000 state=mature
        created: Nov  7 11:45:40 2022   current: Nov  7 11:50:59 2022
        diff: 319(s)    hard: 10800(s)  soft: 9936(s)
        last: Nov  7 11:45:41 2022      hard: 0(s)      soft: 0(s)
        current: 43120(bytes)   hard: 4294967296(bytes) soft: 3951369912(bytes)
        allocated: 308  hard: 0 soft: 0
        sadb_seq=1 pid=82707 refcnt=1
77.63.3.10[4500] 192.168.0.42[20489]
        esp-udp mode=any spi=2764104780(0xa4c0e44c) reqid=0(0x00000000)
        E: aes-gcm-16  c3e1e876 1682b734 daaea57f 181351f1 4d9ab601
        seq=0x00000000 replay=64 flags=0x00000000 state=mature
        created: Nov  7 11:45:40 2022   current: Nov  7 11:50:59 2022
        diff: 319(s)    hard: 10800(s)  soft: 9417(s)
        last:                           hard: 0(s)      soft: 0(s)
        current: 0(bytes)       hard: 4294967296(bytes) soft: 3745211482(bytes)
        allocated: 0    hard: 0 soft: 0
        sadb_seq=0 pid=82707 refcnt=1
```

# strongSwan

## Config
```
pools {
   rw-pool {
        addrs  = 10.0.5.100/32
        dns = 192.168.0.42
   }
}

connections {
   bram {
      local_addrs  = 192.168.0.42
      local {
         auth = pubkey
         certs = server.crt
         id = vpn.cbbg.nl
      }
      remote {
          auth = pubkey
      }
      children {
          vpn {
              remote_ts = 10.0.5.0/24
          }
      }
      pools = rw-pool
  }
}
```

## Network dumps
```
11:52:40.099727 IP 192.168.0.42.4500 > 77.63.3.10.20491: UDP-encap: ESP(spi=0xc88b1c4c,seq=0x15), length 120
11:52:40.158883 IP 77.63.3.10.20491 > 192.168.0.42.4500: UDP-encap: ESP(spi=0xc3ecb931,seq=0x15), length 120

Interface: enc0
11:52:40.099701 (authentic,confidential): SPI 0xc88b1c4c: IP 192.168.0.42 > 10.0.5.100: ICMP echo request, id 59458, seq 423, length 64
11:52:40.158916 (authentic,confidential): SPI 0xc3ecb931: IP 10.0.5.100 > 192.168.0.42: ICMP echo reply, id 59458, seq 423, length 64
```

### Policy
```
duvel# setkey -PD
10.0.5.0/24[any] 192.168.0.42[any] any
        in ipsec
        esp/tunnel/77.63.3.10-192.168.0.42/unique:1
        created: Nov  7 11:52:21 2022  lastused: Nov  7 11:53:40 2022
        lifetime: 9223372036854775807(s) validtime: 0(s)
        spid=219 seq=1 pid=82728 scope=global
        refcnt=2
192.168.0.42[any] 10.0.5.0/24[any] any
        out ipsec
        esp/tunnel/192.168.0.42-77.63.3.10/unique:1
        created: Nov  7 11:52:21 2022  lastused: Nov  7 11:53:16 2022
        lifetime: 9223372036854775807(s) validtime: 0(s)
        spid=220 seq=0 pid=82728 scope=global
        refcnt=2
```

### SA
```		
duvel# setkey -D
192.168.0.42[4500] 77.63.3.10[20491]
        esp-udp mode=tunnel spi=3364559948(0xc88b1c4c) reqid=1(0x00000001)
        E: aes-gcm-16  a24c6762 111eb814 d95f1ba6 994b93f5 b23784c2
        seq=0x00000062 replay=0 flags=0x00000000 state=mature
        created: Nov  7 11:52:21 2022   current: Nov  7 11:53:54 2022
        diff: 93(s)     hard: 3960(s)   soft: 3357(s)
        last: Nov  7 11:52:21 2022      hard: 0(s)      soft: 0(s)
        current: 13368(bytes)   hard: 0(bytes)  soft: 0(bytes)
        allocated: 98   hard: 0 soft: 0
        sadb_seq=1 pid=82731 refcnt=1
77.63.3.10[20491] 192.168.0.42[4500]
        esp-udp mode=tunnel spi=3287071025(0xc3ecb931) reqid=1(0x00000001)
        E: aes-gcm-16  1af15fc9 084918a6 49389fae 0437c952 6dc4a514
        seq=0x00000062 replay=4 flags=0x00000000 state=mature
        created: Nov  7 11:52:21 2022   current: Nov  7 11:53:54 2022
        diff: 93(s)     hard: 3960(s)   soft: 3491(s)
        last: Nov  7 11:52:21 2022      hard: 0(s)      soft: 0(s)
        current: 8062(bytes)    hard: 0(bytes)  soft: 0(bytes)
        allocated: 98   hard: 0 soft: 0
        sadb_seq=0 pid=82731 refcnt=1
```

**Comment by tobhe** [comment]
Thank you for the report. Your config looks fine to me. Can you be a bit more specific about what kind of packet loss you are seeing. Does it happen in bursts or all the time? How did you notice it other than looking at the counter? How much traffic are you moving over the tunnel?

**Comment by bramton** [comment]
The packet loss is 100%. I'm not moving more traffic then a mere ping packet. Yesterday I found a new piece to the puzzle, I was exploring the locations where the esps_notdb counters where incremented.
It happens here:
[/sys/netipsec/udpencap.c#L174](https://github.com/freebsd/freebsd-src/blob/882fc6da1a5f810b18971329a31663498e61bbbf/sys/netipsec/udpencap.c#L174)

I've added some debugging statements and found that `sav->natt->sport`/`sav->natt->dport` seem to be swapped. I've modified the source code by swapping these ports, and now the packets are not dropped anymore. But (there is always a but), now the strongSwan IPsec tunnel stopped working. 

I'm not sure how to interpret this new information yet, does an IKE daemon mingle with the NAT-T rules? If so, in what manner?

**Comment by tobhe** [comment]
Interesting. This could be a bug in our portable pfkey backend used in FreeBSD. I will try to see if I can reproduce it and track it down.

**Comment by tobhe** [comment]
@bramton can you test if https://github.com/tobhe/openiked-portable/commit/54447f492adb23beebd3ca0e302ea703eea7e8c9 fixes the problem? This fix inverts the NAT-T source and destination ports for incoming SAs.

**Comment by bramton** [comment]
Hi tobhe, I can confirm that https://github.com/tobhe/openiked-portable/commit/54447f492adb23beebd3ca0e302ea703eea7e8c9 fixes the problem. Thanks for the fast response.
